[
 {
  "schema": "mission/v1",
  "name": "Perf mission 01",
  "time": {
   "mode": "now"
  },
  "pilot": {
   "lat": 52.19735,
   "lon": 20.88396,
   "aglM": 1.5
  },
  "waypoints": [
   {
    "lat": 52.2836,
    "lon": 21.0668,
    "aglM": 60
   },
   {
    "lat": 52.13298,
    "lon": 20.89999,
    "aglM": 120
   },
   {
    "lat": 52.31908,
    "lon": 21.16528,
    "aglM": 90
   },
   {
    "lat": 52.17185,
    "lon": 21.16989,
    "aglM": 120
   },
   {
    "lat": 52.14121,
    "lon": 21.11053,
    "aglM": 90
   }
  ],
  "returnToPilot": true,
  "links": {
   "control": {
    "radio": "elrs-915-50hz",
    "txPowerDbm": 27,
    "groundAntenna": "truerc-x-air-900",
    "airAntenna": "truerc-x-air-900",
    "requiredMarginDb": 10
   },
   "video": {
    "radio": "dji-o4-video",
    "txPowerDbm": 28.5,
    "groundAntenna": "dji-goggles-3-5g8",
    "airAntenna": "dji-o4-air-unit-5g8",
    "requiredMarginDb": 6
   }
  },
  "evaluate": "both",
  "coverage": {
   "radiusM": 1500,
   "cellM": 100,
   "droneAglM": 80
  }
 },
 {
  "schema": "mission/v1",
  "name": "Perf mission 02",
  "time": {
   "mode": "now"
  },
  "pilot": {
   "lat": 52.29204,
   "lon": 20.95422,
   "aglM": 1.5
  },
  "waypoints": [
   {
    "lat": 52.20314,
    "lon": 21.0907,
    "aglM": 120
   },
   {
    "lat": 52.23681,
    "lon": 20.90987,
    "aglM": 60
   },
   {
    "lat": 52.14687,
    "lon": 20.91929,
    "aglM": 60
   }
  ],
  "returnToPilot": true,
  "links": {
   "control": {
    "radio": "elrs-915-50hz",
    "txPowerDbm": 27,
    "groundAntenna": "truerc-x-air-900",
    "airAntenna": "truerc-x-air-900",
    "requiredMarginDb": 10
   },
   "video": {
    "radio": "dji-o4-video",
    "txPowerDbm": 28.5,
    "groundAntenna": "dji-goggles-3-5g8",
    "airAntenna": "dji-o4-air-unit-5g8",
    "requiredMarginDb": 6
   }
  },
  "evaluate": "both",
  "coverage": {
   "radiusM": 1500,
   "cellM": 100,
   "droneAglM": 80
  }
 },
 {
  "schema": "mission/v1",
  "name": "Perf mission 03",
  "time": {
   "mode": "now"
  },
  "pilot": {
   "lat": 52.23868,
   "lon": 21.04825,
   "aglM": 1.5
  },
  "waypoints": [
   {
    "lat": 52.19146,
    "lon": 21.04125,
    "aglM": 60
   },
   {
    "lat": 52.15438,
    "lon": 21.0174,
    "aglM": 120
   },
   {
    "lat": 52.33142,
    "lon": 21.0279,
    "aglM": 120
   }
  ],
  "returnToPilot": true,
  "links": {
   "control": {
    "radio": "elrs-915-50hz",
    "txPowerDbm": 27,
    "groundAntenna": "truerc-x-air-900",
    "airAntenna": "truerc-x-air-900",
    "requiredMarginDb": 10
   },
   "video": {
    "radio": "dji-o4-video",
    "txPowerDbm": 28.5,
    "groundAntenna": "dji-goggles-3-5g8",
    "airAntenna": "dji-o4-air-unit-5g8",
    "requiredMarginDb": 6
   }
  },
  "evaluate": "both",
  "coverage": {
   "radiusM": 1500,
   "cellM": 100,
   "droneAglM": 80
  }
 },
 {
  "schema": "mission/v1",
  "name": "Perf mission 04",
  "time": {
   "mode": "now"
  },
  "pilot": {
   "lat": 52.19695,
   "lon": 20.87395,
   "aglM": 1.5
  },
  "waypoints": [
   {
    "lat": 52.20007,
    "lon": 20.95145,
    "aglM": 60
   },
   {
    "lat": 52.23088,
    "lon": 21.16745,
    "aglM": 60
   },
   {
    "lat": 52.18754,
    "lon": 21.06228,
    "aglM": 60
   }
  ],
  "returnToPilot": true,
  "links": {
   "control": {
    "radio": "elrs-915-50hz",
    "txPowerDbm": 27,
    "groundAntenna": "truerc-x-air-900",
    "airAntenna": "truerc-x-air-900",
    "requiredMarginDb": 10
   },
   "video": {
    "radio": "dji-o4-video",
    "txPowerDbm": 28.5,
    "groundAntenna": "dji-goggles-3-5g8",
    "airAntenna": "dji-o4-air-unit-5g8",
    "requiredMarginDb": 6
   }
  },
  "evaluate": "both",
  "coverage": {
   "radiusM": 1500,
   "cellM": 100,
   "droneAglM": 80
  }
 },
 {
  "schema": "mission/v1",
  "name": "Perf mission 05",
  "time": {
   "mode": "now"
  },
  "pilot": {
   "lat": 52.15784,
   "lon": 21.16884,
   "aglM": 1.5
  },
  "waypoints": [
   {
    "lat": 52.27269,
    "lon": 20.91957,
    "aglM": 120
   },
   {
    "lat": 52.26741,
    "lon": 21.0324,
    "aglM": 60
   }
  ],
  "returnToPilot": true,
  "links": {
   "control": {
    "radio": "elrs-915-50hz",
    "txPowerDbm": 27,
    "groundAntenna": "truerc-x-air-900",
    "airAntenna": "truerc-x-air-900",
    "requiredMarginDb": 10
   },
   "video": {
    "radio": "dji-o4-video",
    "txPowerDbm": 28.5,
    "groundAntenna": "dji-goggles-3-5g8",
    "airAntenna": "dji-o4-air-unit-5g8",
    "requiredMarginDb": 6
   }
  },
  "evaluate": "both",
  "coverage": {
   "radiusM": 1500,
   "cellM": 100,
   "droneAglM": 80
  }
 },
 {
  "schema": "mission/v1",
  "name": "Perf mission 06",
  "time": {
   "mode": "now"
  },
  "pilot": {
   "lat": 52.3274,
   "lon": 20.96465,
   "aglM": 1.5
  },
  "waypoints": [
   {
    "lat": 52.20748,
    "lon": 21.12768,
    "aglM": 60
   },
   {
    "lat": 52.19008,
    "lon": 21.02194,
    "aglM": 120
   }
  ],
  "returnToPilot": true,
  "links": {
   "control": {
    "radio": "elrs-915-50hz",
    "txPowerDbm": 27,
    "groundAntenna": "truerc-x-air-900",
    "airAntenna": "truerc-x-air-900",
    "requiredMarginDb": 10
   },
   "video": {
    "radio": "dji-o4-video",
    "txPowerDbm": 28.5,
    "groundAntenna": "dji-goggles-3-5g8",
    "airAntenna": "dji-o4-air-unit-5g8",
    "requiredMarginDb": 6
   }
  },
  "evaluate": "both",
  "coverage": {
   "radiusM": 1500,
   "cellM": 100,
   "droneAglM": 80
  }
 },
 {
  "schema": "mission/v1",
  "name": "Perf mission 07",
  "time": {
   "mode": "now"
  },
  "pilot": {
   "lat": 52.21886,
   "lon": 20.93949,
   "aglM": 1.5
  },
  "waypoints": [
   {
    "lat": 52.18059,
    "lon": 21.01481,
    "aglM": 120
   },
   {
    "lat": 52.14528,
    "lon": 20.87353,
    "aglM": 60
   },
   {
    "lat": 52.31102,
    "lon": 20.85491,
    "aglM": 60
   }
  ],
  "returnToPilot": true,
  "links": {
   "control": {
    "radio": "elrs-915-50hz",
    "txPowerDbm": 27,
    "groundAntenna": "truerc-x-air-900",
    "airAntenna": "truerc-x-air-900",
    "requiredMarginDb": 10
   },
   "video": {
    "radio": "dji-o4-video",
    "txPowerDbm": 28.5,
    "groundAntenna": "dji-goggles-3-5g8",
    "airAntenna": "dji-o4-air-unit-5g8",
    "requiredMarginDb": 6
   }
  },
  "evaluate": "both",
  "coverage": {
   "radiusM": 1500,
   "cellM": 100,
   "droneAglM": 80
  }
 },
 {
  "schema": "mission/v1",
  "name": "Perf mission 08",
  "time": {
   "mode": "now"
  },
  "pilot": {
   "lat": 52.32434,
   "lon": 21.06065,
   "aglM": 1.5
  },
  "waypoints": [
   {
    "lat": 52.27724,
    "lon": 20.98621,
    "aglM": 120
   },
   {
    "lat": 52.1644,
    "lon": 21.08292,
    "aglM": 120
   },
   {
    "lat": 52.2272,
    "lon": 20.99736,
    "aglM": 120
   }
  ],
  "returnToPilot": true,
  "links": {
   "control": {
    "radio": "elrs-915-50hz",
    "txPowerDbm": 27,
    "groundAntenna": "truerc-x-air-900",
    "airAntenna": "truerc-x-air-900",
    "requiredMarginDb": 10
   },
   "video": {
    "radio": "dji-o4-video",
    "txPowerDbm": 28.5,
    "groundAntenna": "dji-goggles-3-5g8",
    "airAntenna": "dji-o4-air-unit-5g8",
    "requiredMarginDb": 6
   }
  },
  "evaluate": "both",
  "coverage": {
   "radiusM": 1500,
   "cellM": 100,
   "droneAglM": 80
  }
 },
 {
  "schema": "mission/v1",
  "name": "Perf mission 09",
  "time": {
   "mode": "now"
  },
  "pilot": {
   "lat": 52.22107,
   "lon": 20.90947,
   "aglM": 1.5
  },
  "waypoints": [
   {
    "lat": 52.208,
    "lon": 21.08899,
    "aglM": 120
   },
   {
    "lat": 52.29231,
    "lon": 21.12591,
    "aglM": 120
   }
  ],
  "returnToPilot": true,
  "links": {
   "control": {
    "radio": "elrs-915-50hz",
    "txPowerDbm": 27,
    "groundAntenna": "truerc-x-air-900",
    "airAntenna": "truerc-x-air-900",
    "requiredMarginDb": 10
   },
   "video": {
    "radio": "dji-o4-video",
    "txPowerDbm": 28.5,
    "groundAntenna": "dji-goggles-3-5g8",
    "airAntenna": "dji-o4-air-unit-5g8",
    "requiredMarginDb": 6
   }
  },
  "evaluate": "both",
  "coverage": {
   "radiusM": 1500,
   "cellM": 100,
   "droneAglM": 80
  }
 },
 {
  "schema": "mission/v1",
  "name": "Perf mission 10",
  "time": {
   "mode": "now"
  },
  "pilot": {
   "lat": 52.14844,
   "lon": 21.16154,
   "aglM": 1.5
  },
  "waypoints": [
   {
    "lat": 52.15623,
    "lon": 21.01872,
    "aglM": 120
   },
   {
    "lat": 52.22273,
    "lon": 21.16749,
    "aglM": 60
   },
   {
    "lat": 52.21127,
    "lon": 21.05819,
    "aglM": 120
   },
   {
    "lat": 52.22824,
    "lon": 21.05048,
    "aglM": 90
   }
  ],
  "returnToPilot": true,
  "links": {
   "control": {
    "radio": "elrs-915-50hz",
    "txPowerDbm": 27,
    "groundAntenna": "truerc-x-air-900",
    "airAntenna": "truerc-x-air-900",
    "requiredMarginDb": 10
   },
   "video": {
    "radio": "dji-o4-video",
    "txPowerDbm": 28.5,
    "groundAntenna": "dji-goggles-3-5g8",
    "airAntenna": "dji-o4-air-unit-5g8",
    "requiredMarginDb": 6
   }
  },
  "evaluate": "both",
  "coverage": {
   "radiusM": 1500,
   "cellM": 100,
   "droneAglM": 80
  }
 },
 {
  "schema": "mission/v1",
  "name": "Perf mission 11",
  "time": {
   "mode": "now"
  },
  "pilot": {
   "lat": 52.32837,
   "lon": 20.85091,
   "aglM": 1.5
  },
  "waypoints": [
   {
    "lat": 52.26253,
    "lon": 21.07434,
    "aglM": 60
   },
   {
    "lat": 52.30245,
    "lon": 21.04359,
    "aglM": 60
   }
  ],
  "returnToPilot": true,
  "links": {
   "control": {
    "radio": "elrs-915-50hz",
    "txPowerDbm": 27,
    "groundAntenna": "truerc-x-air-900",
    "airAntenna": "truerc-x-air-900",
    "requiredMarginDb": 10
   },
   "video": {
    "radio": "dji-o4-video",
    "txPowerDbm": 28.5,
    "groundAntenna": "dji-goggles-3-5g8",
    "airAntenna": "dji-o4-air-unit-5g8",
    "requiredMarginDb": 6
   }
  },
  "evaluate": "both",
  "coverage": {
   "radiusM": 1500,
   "cellM": 100,
   "droneAglM": 80
  }
 },
 {
  "schema": "mission/v1",
  "name": "Perf mission 12",
  "time": {
   "mode": "now"
  },
  "pilot": {
   "lat": 52.20545,
   "lon": 20.95206,
   "aglM": 1.5
  },
  "waypoints": [
   {